Malcolm Moss,NE Cambridgeshire,Conservative,,http://mps-expenses.guardian.co.uk/mp/104/,not asked to repay anything,,,,"8,901",18.40495,"£ 148,970.00","£ 64,766.00","£ 20,846.00","£ 21,633.00","£ 22,110.00","£ 23,059.00",,,,,,,,,,,,"£1,203 to fees office for non-allowable mortgage interest payments"
Malcolm Rifkind,Kensington & Chelsea,Conservative,,http://mps-expenses.guardian.co.uk/mp/281/,,,,,"12,418",34.22068,"£ 119,685.00","£ 64,766.00",N/A,£ 0.00,£ 0.00,£ 0.00,,,,,,,,,,,"Claimed the smaller London supplement, which amounted to £2,812 last year.",
Malcolm Wicks,Croydon North,Labour,,http://mps-expenses.guardian.co.uk/mp/149/,,,,,"13,888",29.47994,"£ 131,601.00","£ 64,766.00",,,,£ 0.00,,,,,,,,,,,"Entitled to claim for a second home allowance but instead claimed for the more moderate London subsidy of £2,812.",
Maria Miller,Basingstoke,Conservative,,http://mps-expenses.guardian.co.uk/mp/22/,,,,,"4,680",11.72638,"£ 152,888.00","£ 64,766.00",,,,,,,,,,,,,,,Claim for crockery turned down,
Mark Hunter,Cheadle,Liberal Democrat,Shadow Transport Minister; Parliamentary Private Secretary to the Leader,http://mps-expenses.guardian.co.uk/mp/626/,,,,,"3,657",,"£ 149,081.00","£ 64,766.00",N/A,"£ 13,921.00","£ 20,134.00","£ 19,789.00","£1,365 a month",Rent,,,,,,,,,"Claimed for rent, food, utilities, council tax and a television licence but has made no other claims on his second home allowance.",
Mark Lancaster,North East Milton Keynes,Conservative,"Shadow Minister, International Development ",http://mps-expenses.guardian.co.uk/mp/335/,,,,,"1,665",4.231473,"£ 151,619.00","£ 64,766.00",N/A,"£ 17,847.00","£ 21,300.00","£ 22,541.00",£1115 a month,Mortgage interest payments,,,,,,,,,,
Mark Tami,Alyn & Deeside,Labour,Assistant Whip (funded by HM Treasury),http://mps-expenses.guardian.co.uk/mp/5/,,,,,"8,378",24.17056,"£ 144,749.00","£ 64,766.00","£ 20,143.00","£ 21,578.00","£ 22,098.00","£ 23,079.00","£ 9,000.00",Stamp duty,"£1,300 a month",Mortgage interest payments,,,,,,,,
Mark Williams,Ceredigion,Liberal Democrat,Shadow Minister for Wales,http://mps-expenses.guardian.co.uk/mp/118/,,,,,219,0.833968,"£ 145,483.00","£ 64,766.00",N/A,"£ 17,531.00","£ 19,552.00","£ 19,787.00","Up to £1,300 a month",Rent,,,,,,,,,,
Margaret Beckett,Derby South,Labour,Housing and planning secretary,http://mps-expenses.guardian.co.uk/mp/159/,,Yes,6/5/2009,Resigned cabinet after reshuffle,"5,657",14.37027,"£ 137,206.00","£ 104,050.00","£ 19,088.00","£ 21,415.00","£ 15,430.00","£ 16,974.00","£ 1,800.00",Food,"£ 1,824.00",Utilities,£ 191.00,Telephone and communications,"£ 1,245.00",Cleaning,"£ 1,920.00",Service and maintenance,"Claimed second home allowances of £72,537 on her constituency home in Derby between 2004 and 2008 despite having no mortgage or rent to pay.",
Margaret Moran,Luton South,Labour,,http://mps-expenses.guardian.co.uk/mp/318/,,Yes,5/28/2009,Leaving at next election,"5,650",17.00783,"£ 160,467.00","£ 64,766.00","£ 13,796.00","£ 16,656.00","£ 22,109.00","£ 22,343.00","£ 22,500.00",Dry rot treatment,"£ 4,756.40",New kitchen,"£ 2,678.00",Carpet,£ 527.20,Bed,"£ 2,350.00",Garden work,Margaret Moran has faced criticism for claiming for a second home in Southampton when her constituency is Luton.,"£22,500"
Maria Eagle,"Liverpool, Garston",Labour,Junior minister at the Equalities Office and the Ministry of Justice,http://mps-expenses.guardian.co.uk/mp/308/,,,,,"7,193",19.0291,"£ 153,742.00",,"£ 8,926.00","£ 11,264.00","£ 18,991.00","£ 17,124.00","£ 3,500.00",Refurbishing bathroom,£739.22 a month,Mortgage interest payments,,,,,,,"Claimed thousands of pounds to refurbish a bathroom at one of her flats, shortly before switching her second home to a property with a higher mortgage.",
Mark Francois,Rayleigh,Consevative,Shadow Miniter for Europe,http://mps-expenses.guardian.co.uk/mp/391/,,,,,"14,726",28.75161,"£ 141,792.00","£ 64,766.00","£ 19,990.00","£ 18,509.00","£ 20,374.00","£ 20,689.00","£15,000 per month",Rent on a second home,,,,,,,,,"He claimed for a number of different snacks including icecream, chocolate bars, bags of sweets and Peperami sausage sticks.",
Mark Hendrick,Preston,Labour,,http://mps-expenses.guardian.co.uk/mp/388/,,,,,"9,407",27.33004,"£ 140,443.00","£ 64,766.00","£ 20,902.00","£ 21,471.00","£ 21,867.00","£ 16,226.00",£ 599.99,Television,£ 799.90,Washing Machine,"£ 2,616.12",New doors,"£ 1,522.00",Glazing,"£ 1,137.00",Fences and gates,"Admits he ""estimated"" the mortgage interest that he was paying on his designated second home. After paying off the mortgage on this property he changed his designated second home to his Preston properly and then claimed back the mortgage interest he was paying on it.","£ 6,850.00"
Mark Hoban,Fareham,Conservative,"Shadow Minister, Treasury",http://mps-expenses.guardian.co.uk/mp/207/,,,,,"11,702",24.22674,"£ 144,636.00","£ 64,766.00
","£ 20,049.00","£ 21,545.00","£ 19,788.00","£ 21,280.00",£ 35.00,Toilet roll holder,£ 100.00,Shower rack,£ 79.00,Four silk cushion covers,£ 18.00,Bath mat,£ 18.00,,,
Mark Lazarowicz,Edinburgh North & leith,Labour and Co-operative,,http://mps-expenses.guardian.co.uk/mp/593/,,,,,"2,153",7.374803,"£ 165,171.00","£ 64,766.00
","£ 19,459.00","£ 17,547.00","£ 19,452.00","£ 21,774.00","£ 2,675.00",legal and professional fees,,,,,,,,,,"£ 2,675.00"
Mark Oaten,Winchester,Lib Dem,,http://mps-expenses.guardian.co.uk/mp/543/,,,,,"7,476",11.97118,"£ 155,911.00","£ 64,766.00
","£ 20,902.00","£ 21,558.00","£ 22,110.00","£ 22,993.00",£ 116.00,irons ober 3 years,,,,,,,,,,
Mark Prisk,Hertford & Stortford,Conservative,Shadow business minister,http://mps-expenses.guardian.co.uk/mp/252/,,,,,"13,097",26.1167,"£ 147,195.00","£ 64,766.00","£ 20,628.00","£ 17,826.00","£ 16,441.00","£ 20,733.00","£ 1,182.00",One month mortgage interest,,,,,,,,,"Accidentally claimed £1,726 rather than £1,182 for one month's mortgage interest on London home. Error was spotted by officials.",
Mark Pritchard,The Wrekin,Conservative,,http://mps-expenses.guardian.co.uk/mp/561/,,,,,942,2.492195,"£ 161,827.00","£ 64,766.00",N/A,"£ 21,634.00","£ 21,499.00","£ 23,083.00",£ 199.00,Vacuum cleaner,"£ 1,000.00",Furnishings,£ 66.00,Kitchen utensils,£ 45.00,Bedding,£ 145.00,Microwave,Moved flats in Westminster in 2007.,
Mark Simmonds,Boston & Skegness,Conservative,Shadow health minister,http://mps-expenses.guardian.co.uk/mp/66/,not asked to repay anything,,,,"5,907",15.28015,"£ 153,873.00","£ 64,766.00","£ 20,902.00","£ 21,634.00","£ 22,110.00","£ 23,083.00","£2,696 a month",Mortgage interest,,,,,,,,,"Claims up to £2,696 a month for interest-only mortgage on second home in London.",
Mark Todd,South Derbyshire,Labour,,http://mps-expenses.guardian.co.uk/mp/161/,,,,,"4,495",9.054103,"£ 150,264.00","£ 64,766.00
","£ 20,902.00","£ 21,634.00","£ 22,061.00","£ 19,023.00",£ 300.00,Monthly mortgage interest payments,"£ 7,644.52","Replacing radiators, and tiles in the kitchen and bathroom (2005-2006)","£ 4,964.00",Kitchen surfaces (2006-2007),£ 889.15,Lighting (2006-2007),"£ 1,089.00",Sink (2006-2007),"Claimed a total of £24,877 for renovating his flat between 2004-05 and 2007-08.",
Marsha Singh,Bradford West,Labour,,http://mps-expenses.guardian.co.uk/mp/73/,,,,,"3,026",10.38435,"£ 143,353.00","£ 64,766.00","£ 16,439.00","£ 15,852.00","£ 22,100.00","£ 22,964.00",£ 750.00,Television,£ 229.00,DVD player,£ 400.00,Music player,,,,,"Claimed mortgage interest payments for London flat as second home. Claimed for television, DVD player and music player with a handwritten receipt.",
Martin Caton,Gower,Labour,,http://mps-expenses.guardian.co.uk/mp/222/,,,,,"6,703",19.96604,"£ 131,324.00","£ 64,766.00",,,,"£ 13,022.00",£460 a month,Mortgage interest,£350 a month,Food and other bills,"£ 3,216.00",New bathroom equipment,"£ 6,400.00",New kitchen,,,,
Martin Horwood,Cheltenham,Liberal Democrat,"Shadow Environment, Energy, Food and Rural Affair Minister",http://mps-expenses.guardian.co.uk/mp/122/,,,,,"2,303",6.354155,"£ 152,892.00","£ 64,766.00",N/A,"£ 17,339.00","£ 22,110.00","£ 21,449.00","£1,500 a month",Rent,£ 2.39,Plasters,£ 1.79,Savlon,,,,,"Claimed large monthly mortgage interest bills of around £1,500 and occasional food bills.",
Martyn Jones,Clwyd South,Labour,,http://mps-expenses.guardian.co.uk/mp/133/,,,,,"6,348",21.43436,"£ 133,729.00","£ 64,766.00","£ 19,003.00","£ 21,634.00","£ 21,030.00","£ 23,083.00",£165 a month,Car parking space,£400 a month,Food,£ 764.00,Sofa bed,£ 129.00,Microwave,,,Rents a flat near Parliament. Usually claimed £400 a month for food.,
Martin Linton,Battersea,Labour,,http://mps-expenses.guardian.co.uk/mp/26/,,,,,163,0.4918824,"£ 131,070.00","£ 64,766.00",N/A,N/A,N/A,N/A,,,,,,,,,,,,
Martin McGuinness,Mid-Ulster,Sinn Féin,Northern Ireland's deputy first minister,http://mpsallowances.parliament.uk/mpslordsandoffices/hocallowances/allowances-by-mp/martin-mcguinness,,,,,"10,976",25.35927,"£ 136,236.00","£ 106,598.00","£ 15,683.00","£ 7,500.00","£ 21,057.00","£ 21,000.00","£3,600 a month",Rent,,,,,,,,,"Jointly claimed with Gerry Adams £3,600 a month to rent a flat in London, well above the market rate, despite never taking up his seat in Westminster.  Between them the five Sinn Féin MPs have claimed over £310,000 in five years for three properties rented from three members of one family.  The MPs say their rent includes parking, housekeeping and utility bills.",
Martin Salter,Reading West,Labour,,http://mps-expenses.guardian.co.uk/mp/393/,,,,,"4,682",12.36008,"£ 132,263.00","£ 64,766.00",,£ 0.00,£ 0.00,£ 0.00,,,,,,,,,,,Has not made any claims on his second home allowance since 2004/05,
Mary Creagh,Wakefield,Labour,,http://mps-expenses.guardian.co.uk/mp/513/,,,,,"5,154",13.70599,"£ 142,644.00","£ 64,766.00",,,,"£ 23,083.00","£ 9,000.00",Stamp duty,"£ 1,184.00",Solicitors' fees,"£ 4,480.00",New roof,,,,,"Appointed north London flat as second home, then switched to new home in Wakefield.",
Matthew Taylor,Truro & St Austell,Liberal Democrat,,http://mps-expenses.guardian.co.uk/mp/498/,,,,,"7,403",15.36593,"£ 162,040.00","£ 64,766.00","£ 20,902.00","£ 21,634.00","£ 22,110.00","£ 23,083.00",£ 350.00,gardening,"£ 1,373.00",Curtains and blinds,,,,,,,"Claims for a flat in London, owns and rents out a second flat in the capital",
Meg Hillier,Hackney South and Shoreditch,Labour,,http://mps-expenses.guardian.co.uk/mp/229/,,,,,"10,204",29.92726,"£ 126,487.00","£ 64,766.00",N/A,N/A,N/A,N/A,,,,,,,,,,,"As an inner London MP, not eligible to claim for a second home allowance, but she claimed the maximum London supplement of £2,812 last year.",
Meg Munn,Sheffield Heeley,Labour,,http://mps-expenses.guardian.co.uk/mp/430/,,,,,"11,370",30.88835,"£ 144,356.00","£ 64,766.00","£ 20,902.00","£ 21,509.00","£ 22,110.00","£ 23,083.00","£1,350 a month",Mortgage interest payments,,,,,,,,,"Claimed maximum second home allowances in three of the four years. Husband Dennis Bates was paid from expenses to give tax advice to a dozen Labour MPs. Like many colleagues, claimed hundreds of pounds in office expenses for financial advice services provided by her husband.",
Sir Menzies Campbell,Fife North East,Liberal Democrat,Former leader of the Liberal Democrats,http://mps-expenses.guardian.co.uk/mp/598/,,,,,"12,571",31.28983,"£ 157,112.00","£ 64,766.00",,"£ 11,611.00","£ 16,667.00","£ 22,570.00",£ 528.75,Roman blinds,£ 176.25,Cushions,"£ 1,420.00",Shelving,"£1,024 ",King-size bed,£373 ,Bed linen,"Former Lib Dem leader Sir Menzies spent nearly £10,000 of taxpayer funds refurbishing his central London flat. Among the items claimed were a new king-size bed worth £1,024, bed linen worth £373 and five cushions costing £176.25. He also claimed thousands of pounds of food over the summer recess.","£ 1,490.66"
Michael Ancram,Devizes,Conservative,,http://mps-expenses.guardian.co.uk/mp/163/,,,,,"13,194",24.20651,"£ 135,695.00","£ 64,766.00","£ 14,164.00","£ 14,916.00","£ 22,030.00","£ 15,756.00","£ 3,000.00",Cleaning (for one year),"£ 1,250.00",Gardening (for one year),£ 98.58,Swimming pool boiler maintenance,£ 90.17,House boiler service,£ 72.50,Boiler service at housekeeper's cottage,"Claimed for having his swimming pool boiler serviced. Claimed for maintenance set in the grounds of his home, used by his housekeeper.",£ 98.58
Michael Clapham,Barnsley West & Penistone,Labour,,http://mps-expenses.guardian.co.uk/mp/19/,,,,,"11,314",27.76851,"£ 106,710.00","£ 64,766.00","£ 16,095.00","£ 20,549.00","£ 19,592.00","£ 20,256.00",£ 210.00,Glasses for his wife (reduced to £50),£ 19.97,Iron,"£ 1,500.00",Replacing flagstones,£ 80.00,Re-cording sash windows,£ 892.00,Self-assembly bedroom furniture,"By claiming under the threshold he was able to get £20,860 over five years for cleaning and groceries without ever producing a receipt.",
Michael Connarty,Linlithgow & Falkirk East,Labour,,http://mps-expenses.guardian.co.uk/mp/610/,,,,,"11,202",25.31983,"£ 183,466.00","£ 64,766.00","£ 20,251.16","£ 21,634.00","£ 21,248.00","£ 23,083.00",£ 250.00,Alarm clock,£ 379.99,Television,£ 69.99,Freeview box,"£ 1,114.75",Bed,£ 149.00,Footstool,"Sold some of the contents of his London home to his colleague, Jim Devine, before claiming thousands of pounds for items for his home in Scotland.",
Michael Gove,Surrey Heath,Conservative,Shadow education secretary,http://mps-expenses.guardian.co.uk/mp/473/,,,,,"10,845",22.00511,"£ 152,071.00","£ 64,766.00",N/A,"£ 21,634.00","£ 22,110.00","£ 23,083.00",£ 134.50,Elephant lamps,£ 750.00,Loire table,£ 702.00,Fridge freezer,"£ 13,259.00",Moving house,,,"Spent more than £7,000 furnishing a London property in 2006 before “flipping” the second home designation to a new one in his Surrey Heath constituency.","£ 7,567.00"
Michael Howard,Folkestone & Hythe,Conservative,,http://mps-expenses.guardian.co.uk/mp/212/,,,,,"11,680",22.32331,"£ 114,990.00","£ 64,766.00","£ 18,935.00","£ 21,634.00","£ 19,283.00","£ 18,200.00","£ 17,351.00",Gardening (2004-2008),,,,,,,,,,
Michael Jack,Fylde,Conservative,,http://mps-expenses.guardian.co.uk/mp/215/,,,,,"12,459",25.64952,"£ 134,257.00","£ 64,766.00","£ 17,557.00","£ 19,102.00","£ 19,651.00","£ 22,000.00","£ 1,250.00",Sanding and varnishing kitchen floor,"£ 1,200.00",Fridge freezer,"£ 1,295.00",Redecoration,"£ 1,410.00",Kitchen cupboards,,,Designated a second home in London.,
Sir Michael Lord,Central Suffolk and North Ipswitch,Conservative,Deputy Speaker,http://mps-expenses.guardian.co.uk/mp/629/,,,,,"7,856",17.58832,"£ 121,772.00","£ 99,114.00","£ 20,338.00","£ 21,624.00","£ 22,110.00","£ 23,047.00","over £8,000",Gardening over 5 years,"over £6,000",Heating oil over 5 years,"£ 372,193.00",Repairs,"£ 2,789.90",Bathroom suite,"£ 2,046.27",Fitting of the bathroom suite,,
Michael Martin,Glasgow North East,,Speaker of the House of Commons,http://mpsallowances.parliament.uk/mpslordsandoffices/hocallowances/allowances-by-mp/michael-martin,,Yes,5/19/2009,"Leaving at next election, also stepping down as Speaker on June 21","10,134",33.43892,"£ 74,522.00","£ 138,724.00","£ 6,106.00","£ 9,551.00","£ 17,346.00","£ 11,750.00","£ 1,400.00",Chauffeur hire (2004-05),"£ 2,200.00",Food (2007-08),"£ 1,834.00",Carpets,"£ 3,000.00",Pest control,"£ 1,490.00",Redecorating a room,"Spent more than £1,400 on chauffeurs in his constituency, including journeys to the local job centre and to Celtic Park football ground. Claimed £1,050 for food in July-September 2007, during the summer recess when MPs generally should not be claiming for second home expenses.",
Michael Mates,East Hampshire,Conservative,,http://mps-expenses.guardian.co.uk/mp/233/,,,,,"5,509",11.348,"£ 140,258.00","£ 64,766.00","£ 20,543.00","£ 21,556.00","£ 22,110.00","£ 23,077.00",£ 91.00,monthly car parking,,,,,,,,,,
Michael Moore,"Berwickshire, Roxburgh and Selkirk",Lib Dem,,http://mps-expenses.guardian.co.uk/mp/580/,,,,,"5,901",15.53467,"£ 163,098.00","£ 64,766.00","£ 19,909.00","£ 21,570.00","£ 21,676.00","£ 21,563.00",£ 64.00,Electric razor (disallowed),,,,,,,,,,
Sir Michael Spicer,West Worcestershire,Conservative,Chairman of the 1922 Committee of backbench MPs,http://mps-expenses.guardian.co.uk/mp/556/,,,,,"2,475",5.904385,"£ 109,208.00","£ 64,766.00","£ 20,902.00","£ 21,634.00","£ 22,110.00","£ 21,162.00",£ 620.00,Installation and rewiring of chandelier,"£ 1,000.00",Servicing oven,"£ 5,650.00",Gardening,"£ 4,000.00",Council tax on two homes,£300 a month,Cleaner,"Claimed £609 for cutting hedge around helipad and vegetable garden. In one nine-month period claimed £5,650 for gardening work. Claimed for both his manor house and a cottage next door.",
Michael Wills,North Swindon,Labour,Justice Minister,http://mps-expenses.guardian.co.uk/mp/480/,,,,,"2,571",6.55466,"£ 153,138.00","£ 105,525.00","£ 16,948.00","£ 10,661.00","£ 16,051.00","£ 20,766.00","£1,120 a month",Mortgage interest,,,,,,,,,"On one occasion, the fees office agreed to pay £2,633 for a claim made two months after the deadline for 2005-06 had passed. He said a 'genuine mistake' had been made by a 'trusted and normally reliable member of staff'.",
Michelle Gildernew,Fermanagh & South Tyrone,Sinn Féin,,http://mpsallowances.parliament.uk/mpslordsandoffices/hocallowances/allowances-by-mp/michelle-gildernew,,,,,"4,582",12.29209,"£ 138,272.00","£ 33,939.00","£ 19,240.00","£ 7,500.00","£ 18,000.00","£ 21,000.00","£5,400 a month",Rent,,,,,,,,,"Jointly claimed £5,400 a month to rent a house shared with Pat Doherty and Conor Murphy, well above the market rate, despite never taking up her seat in Westminster.  Between them the five Sinn Féin MPs have claimed over £310,000 in five years for three properties rented from three members of one family.  The MPs say their rent includes parking, housekeeping and utility bills.",
Mike Hall,Weaver Vale,Labour,,http://mps-expenses.guardian.co.uk/mp/529/,,,,,"6,855",18.27123,"£ 167,791.00","£ 64,766.00","£ 20,902.00","£ 21,634.00","£ 22,110.00","£ 23,067.00","£ 5,194.00",Cleaning (2005-06),"£ 4,346.00",Cleaning (2006-07),"£ 5,408.00",Cleaning (2007-08),£250 a month,Household sundries,£940 a month,Mortgage interest payments,"Claimed thousands of pounds in expenses for cleaners, cleaning products and laundry bills for his London home. ",
Mike Hancock,Portsmouth South,Liberal Democrat,,http://mps-expenses.guardian.co.uk/mp/386/,,,,,"3,362",9.860972,"£ 142,347.00","£ 64,766.00","£ 12,739.00","£ 8,952.00","£ 11,706.00","£ 10,859.00",£ 235.00,Monthly mortgage interest payments 2006-2008,£ 100.00,Rug,£ 50.00,Iron,,,,,His additional costs allowance for the last five years placed him 548th lowest of 645 MPs last year.  The police had previously been called after a consituency resident followed Mr Hancock in protest of his refusal to publish a breakdown of his claims.,
Mike O'Brien,Warwickshire North,Labour,,http://mps-expenses.guardian.co.uk/mp/525/,,,,,"7,553",16.73906,"£ 144,360.00","£ 104,050.00","£ 9,723.00","£ 9,580.00","£ 10,958.00","£ 8,963.00",£ 825.00,Television (over maximum allowed),,,,,,,,,,
Mike Penning,Hemel Hempstead,Conservative,"Shadow Minister, Health",http://mps-expenses.guardian.co.uk/mp/248/,,,,,499,1.313158,"£ 149,487.00","£ 64,766.00",N/A,"£ 21,513.00","£ 22,210.00","£ 23,083.00",£ 2.99,Dog bowl,"£ 10,049.00","Stamp duty (paid £8,750.55)",£ 428.01,Radiator,"£ 1,632.00",Fencing,,,Claimed for a radiator in his cellar and a dog bowl.  His constituency is less than 30 miles from Westminster.,£ 2.99
Mike Weir,Angus,SNP,"Spokesperson (Business, Enterprise and Regulatory Reform; Energy; Work and Pensions)",http://mpsallowances.parliament.uk/mpslordsandoffices/hocallowances/allowances-by-mp/mike-weir,,,,,"1,590",6.234424,"£ 143,525.00","£ 64,766.00","£ 19,409.00","£ 18,448.00","£ 21,082.00","£ 21,561.00","£1,300 a month ",Rent,,,,,,,,,"Also claimed for utilities, telephone, council tax and food",
Mike Wood,Batley & Spen,Labour,,http://mps-expenses.guardian.co.uk/mp/25/,,,,,"5,788",16.10103,"£ 144,984.00","£ 64,766.00","£ 19,555.00","£ 14,533.00","£ 18,038.00","£ 17,976.00",£500 a month,London flat,"£ 3,421.76",Central heating boiler,£ 599.99,Television,"£ 1,332.00",New bathroom,,,,
Mohammad Sarwar,Glasgow Central,Labour,,http://mps-expenses.guardian.co.uk/mp/599/,,,,,"8,531",31.55422,"£ 174,882.00","£ 64,766.00","£ 20,822.00","£ 20,820.00","£ 22,110.00","£ 22,745.00","£2,000 a month",Mortgage interest payments,"£3,000 a year",Ground rent and service charges,"£ 1,500.00",Council tax,,,,,"Claimed almost £100,000 to cover mortgage interest paid from an account with a Swiss bank. Has an estimated fortune of £16 million, but has claimed close to the maximum under his second home allowance since 2004.",
Natascha Engel,North East Derbyshire,Labour,Parliamentary private secretary to Minister of State at Cabinet Office,http://mps-expenses.guardian.co.uk/mp/160/,,,,,"10,065",23.49879,"£ 149,621.00","£ 64,766.00",N/A,"£ 21,064.00","£ 22,110.00","£ 20,267.00","£ 2,000.00",Sofa,£ 750.00,Bed,£ 30.00,Champagne flute,£ 750.00,Television,"£ 1,666.00",Kitchen electrical items,Claimed thousands of pounds within months of being elected. She has now called a series of meetings for her constituents to decide whether or not she should stand down.,
Neil Gerrard,Walthamstow,Labour,,http://mps-expenses.guardian.co.uk/mp/517/,,,,,"7,993",23.07048,"£ 117,044.00","£ 64,766.00
",£ 0.00,£ 0.00,£ 0.00,£ 0.00,,,,,,,,,,,Opted for the London subsidy rather than the second home allowance.,
Neil Turner,Wigan,Labour,,http://mps-expenses.guardian.co.uk/mp/540/,,,,,"11,767",31.12798,"£ 161,218.00","£ 64,766.00","£ 20,902.00","£ 21,634.00","£ 22,110.00","£ 22,979.00",,,,,,,,,,,"Some months claimed upto £400 for food, also claimed for mortgage interest on a flat in London, utilities, council tax and small amounts of furniture.",
Nicholas Soames,Mid Sussex,Conservative,,http://mps-expenses.guardian.co.uk/mp/475/,,,,,"5,890",12.39217,"£ 148,424.00","£ 64,766.00","£ 20,730.00","£ 18,442.00","£ 20,491.00","£ 21,869.00","£1,340 a month",Mortgage interest payments,,,,,,,,,,
Nicholas Winterton,Macclesfield,Conservative,,http://mps-expenses.guardian.co.uk/mp/319/,,Yes,5/24/2009,Leaving at next election,"9,401",20.77294,"£ 89,133.00","£ 64,766.00","£ 14,327.00","£ 13,470.00","£ 14,797.00","£ 14,918.00",£900 a month,Rent,,,,,,,,,"Along with his wife, Lady Ann Winterton, claimed more than £80,000 in rent for a small London flat, owned by a trust controlled by their children.",
Nick Ainger,Carmarthen West & South Pembrokeshire,Labour,,http://mps-expenses.guardian.co.uk/mp/116/,,,,,"1,910",6.844406,"£ 146,530.00","£ 64,766.00",,,,"£ 15,385.00",£ 768.00,Man Ray styling chair,"£ 1,434.00",sofabed,,,,,,,"In total he tried to claim £3,371 for furniture, but was paid £3,075",
Nick Brown,Newcastle upon Tyne East & Wallsend,Labour,Chief Whip and Minister for the North East,http://mps-expenses.guardian.co.uk/mp/350/,asked to return £697.65 for cleaning,,,,"7,565",21.66132,"£ 165,315.00",,,,,"£ 23,068.00",£200 a month,Repairs,£200 a month,Service and maintenance,£250 a month,Cleaner,"£ 6,600.00",Mortgage interest payments (2007-8),"£ 4,800.00",Food,"Claimed £18,800, without receipts, in expenses for food over the course of four years.",
Nick Clegg,"Sheffield, Hallam",Liberal Democrat,Liberal Democrats leader,http://mps-expenses.guardian.co.uk/mp/429/,repaid £910 gardening claim,,,,"8,682",20.96089,"£ 149,026.00","£ 64,766.00",N/A,"£ 21,610.00","£ 22,050.00","£ 23,083.00","£1,018 a month",Mortgage interest payments,"£ 9,244.50","Stamp duty, land registry and legal costs (2005)","£ 2,600.00",Kitchen,"£ 5,857.63",Redecoration,£ 1.50,Ikea paper napkins,"The current Lib Dem leader reported had his second home allowance docked last year after exceeding the £23,083 maximum by more than £100. Other claims made included £1,657.32 for food, and phone bills which included calls to Colombia and Vietnam. He said that when he sells his second home, any profit will go back to the taxpayer. Mr Clegg also said he had paid back the £80.20 cost of the international calls.",£ 80.92
Nick Gibb,Bognor Regis & Littlehampton,Conservative,,http://mps-expenses.guardian.co.uk/mp/60/,,,,,"7,822",21.5091,"£ 158,541.00","£ 64,766.00","£ 20,902.00","£ 21,625.00","£ 22,068.00","£ 23,053.00","£ 8,227.00",Redecoration and repairs,£ 296.00,Hedge trimming,"£ 2,000.00",Fees associated with house purchase,"£1,800 a month",Mortgage interest payments,,,,
Nick Harvey,North Devon,Liberal Democrat,,http://mps-expenses.guardian.co.uk/mp/165/,,,,,"4,972",10.42785,"£ 160,492.00","£ 64,766.00","£ 20,901.00","£ 21,623.00","£ 22,103.00","£ 23,036.00","£1,258 per month",Mortgage interest payments (as of June 2008),£30 per month,Sky Sports subscription,"£ 3,515.00",Food (2004-2008),£ 129.25,"""Two hanging baskets with watering""",,,"Lib Dem MP Mr Harvey, who is nominated as the spokesman for the House of Commons, had to be reminded twice by officials to submit receipts with his expenses.",
Nick Herbert,Arundel & South Downs,Conservative,Shadow environment secretary,http://mps-expenses.guardian.co.uk/mp/10/,,,,,"11,309",22.84462,"£ 141,036.00","£ 64,766.00",N/A,"£ 21,553.00","£ 22,110.00","£ 22,720.00","£ 10,000.00",Stamp duty,£ 150.00,Valuation fee,£675 ,Survey of new property,"£22,720 a year",Mortgage interest payments,,,Bought a new house less than a year after becoming an MP.  Despite his partner also being on the property deeds he claimed the majority of the stamp duty and the entirety of the total mortgage interest costs on his second home allowance.,
